{
  "$schema": "https://json-schema.org/draft/2020-12/schema",
  "$id": "https://faudard.github.io/qt-material3-widget/schema/theme.schema.json",
  "title": "Qt Material 3 Theme JSON Schema",
  "type": "object",
  "additionalProperties": false,
  "required": [
    "formatVersion",
    "source",
    "resolved",
    "metadata"
  ],
  "properties": {
    "formatVersion": {
      "const": 1
    },
    "source": {
      "$ref": "#/$defs/source"
    },
    "resolved": {
      "$ref": "#/$defs/resolved"
    },
    "metadata": {
      "$ref": "#/$defs/metadata"
    }
  },
  "$defs": {
    "color": {
      "type": "string",
      "pattern": "^#[0-9a-fA-F]{8}$"
    },
    "source": {
      "type": "object",
      "additionalProperties": false,
      "required": [
        "seedColor",
        "mode",
        "preference",
        "contrast",
        "variant",
        "colorBackendPolicy"
      ],
      "properties": {
        "seedColor": {
          "$ref": "#/$defs/color"
        },
        "mode": {
          "enum": [
            "Light",
            "Dark"
          ]
        },
        "preference": {
          "enum": [
            "Light",
            "Dark",
            "FollowSystem"
          ]
        },
        "contrast": {
          "enum": [
            "Standard",
            "Medium",
            "High"
          ]
        },
        "variant": {
          "enum": [
            "TonalSpot",
            "Expressive"
          ]
        },
        "colorBackendPolicy": {
          "enum": [
            "Auto",
            "PreferMaterialColorUtilities",
            "ForceMaterialColorUtilities",
            "ForceFallback"
          ]
        },
        "motionScheme": {
          "enum": [
            "Standard",
            "Expressive"
          ],
          "default": "Standard"
        }
      }
    },
    "resolved": {
      "type": "object",
      "additionalProperties": false,
      "required": [
        "colorScheme",
        "typographyScale",
        "shapeScale",
        "elevationScale",
        "motionTokens",
        "stateLayer",
        "accessibility",
        "interactions",
        "density",
        "iconSizes",
        "componentOverrides"
      ],
      "properties": {
        "colorScheme": {
          "type": "object",
          "additionalProperties": {
            "$ref": "#/$defs/color"
          }
        },
        "typographyScale": {
          "type": "object",
          "additionalProperties": {
            "$ref": "#/$defs/typographyStyle"
          }
        },
        "shapeScale": {
          "type": "object",
          "additionalProperties": {
            "type": "integer",
            "minimum": 0
          }
        },
        "elevationScale": {
          "type": "object",
          "additionalProperties": {
            "$ref": "#/$defs/elevationStyle"
          }
        },
        "motionTokens": {
          "type": "object",
          "additionalProperties": {
            "$ref": "#/$defs/motionStyle"
          }
        },
        "stateLayer": {
          "$ref": "#/$defs/stateLayer"
        },
        "accessibility": {
          "$ref": "#/$defs/accessibility"
        },
        "interactions": {
          "$ref": "#/$defs/interactions"
        },
        "density": {
          "type": "object",
          "additionalProperties": {
            "type": "integer"
          }
        },
        "iconSizes": {
          "type": "object",
          "additionalProperties": {
            "type": "integer",
            "minimum": 0
          }
        },
        "componentOverrides": {
          "type": "object",
          "additionalProperties": {
            "$ref": "#/$defs/componentOverride"
          }
        }
      }
    },
    "typographyStyle": {
      "type": "object",
      "additionalProperties": false,
      "required": [
        "font",
        "lineHeight",
        "letterSpacing"
      ],
      "properties": {
        "font": {
          "type": "object",
          "additionalProperties": true
        },
        "lineHeight": {
          "type": "number"
        },
        "letterSpacing": {
          "type": "number"
        }
      }
    },
    "elevationStyle": {
      "type": "object",
      "additionalProperties": false,
      "required": [
        "shadowBlur",
        "shadowYOffset",
        "tonalOverlayOpacity"
      ],
      "properties": {
        "shadowBlur": {
          "type": "integer",
          "minimum": 0
        },
        "shadowYOffset": {
          "type": "integer"
        },
        "tonalOverlayOpacity": {
          "type": "number",
          "minimum": 0,
          "maximum": 1
        }
      }
    },
    "motionStyle": {
      "type": "object",
      "additionalProperties": false,
      "required": [
        "durationMs",
        "easingType"
      ],
      "properties": {
        "durationMs": {
          "type": "integer",
          "minimum": 0
        },
        "easingType": {
          "type": "integer"
        }
      }
    },
    "stateLayer": {
      "type": "object",
      "additionalProperties": false,
      "required": [
        "color",
        "hoverOpacity",
        "focusOpacity",
        "pressOpacity",
        "dragOpacity"
      ],
      "properties": {
        "color": {
          "$ref": "#/$defs/color"
        },
        "hoverOpacity": {
          "type": "number",
          "minimum": 0,
          "maximum": 1
        },
        "focusOpacity": {
          "type": "number",
          "minimum": 0,
          "maximum": 1
        },
        "pressOpacity": {
          "type": "number",
          "minimum": 0,
          "maximum": 1
        },
        "dragOpacity": {
          "type": "number",
          "minimum": 0,
          "maximum": 1
        }
      }
    },
    "accessibility": {
      "type": "object",
      "additionalProperties": false,
      "required": [
        "highContrast",
        "reducedMotion",
        "minimumTextContrastRatio",
        "minimumUiContrastRatio",
        "focusRing"
      ],
      "properties": {
        "highContrast": {
          "type": "boolean"
        },
        "reducedMotion": {
          "type": "boolean"
        },
        "minimumTextContrastRatio": {
          "type": "number"
        },
        "minimumUiContrastRatio": {
          "type": "number"
        },
        "focusRing": {
          "type": "object",
          "additionalProperties": false,
          "required": [
            "width",
            "offset",
            "radiusAdjustment",
            "color",
            "opacity"
          ],
          "properties": {
            "width": {
              "type": "integer",
              "minimum": 0
            },
            "offset": {
              "type": "integer",
              "minimum": 0
            },
            "radiusAdjustment": {
              "type": "integer"
            },
            "color": {
              "$ref": "#/$defs/color"
            },
            "opacity": {
              "type": "number",
              "minimum": 0,
              "maximum": 1
            }
          }
        }
      }
    },
    "interactions": {
      "type": "object",
      "additionalProperties": false,
      "required": [
        "keyboardFocusVisible",
        "strongFocusIndicators",
        "hoverFeedbackEnabled",
        "pressFeedbackEnabled",
        "dragFeedbackEnabled"
      ],
      "properties": {
        "keyboardFocusVisible": {
          "type": "boolean"
        },
        "strongFocusIndicators": {
          "type": "boolean"
        },
        "hoverFeedbackEnabled": {
          "type": "boolean"
        },
        "pressFeedbackEnabled": {
          "type": "boolean"
        },
        "dragFeedbackEnabled": {
          "type": "boolean"
        }
      }
    },
    "componentOverride": {
      "type": "object",
      "additionalProperties": false,
      "properties": {
        "colors": {
          "type": "object",
          "additionalProperties": {
            "$ref": "#/$defs/color"
          }
        },
        "typography": {
          "type": "object",
          "additionalProperties": {
            "$ref": "#/$defs/typographyStyle"
          }
        },
        "shapes": {
          "type": "object",
          "additionalProperties": {
            "type": "integer"
          }
        },
        "elevations": {
          "type": "object",
          "additionalProperties": {
            "$ref": "#/$defs/elevationStyle"
          }
        },
        "motion": {
          "type": "object",
          "additionalProperties": {
            "$ref": "#/$defs/motionStyle"
          }
        },
        "density": {
          "type": "object",
          "additionalProperties": {
            "type": "integer"
          }
        },
        "iconSizes": {
          "type": "object",
          "additionalProperties": {
            "type": "integer"
          }
        },
        "stateLayer": {
          "$ref": "#/$defs/stateLayer"
        },
        "custom": {
          "type": "object",
          "additionalProperties": true
        }
      }
    },
    "metadata": {
      "type": "object",
      "additionalProperties": false,
      "required": [
        "generatorVersion",
        "libraryVersion",
        "qtVersion"
      ],
      "properties": {
        "generatorVersion": {
          "type": "string"
        },
        "libraryVersion": {
          "type": "string"
        },
        "qtVersion": {
          "type": "string"
        },
        "timestamp": {
          "type": "string",
          "format": "date-time"
        }
      }
    }
  }
}
